{
  "as_of": "2026-08-18T13:32:00Z",
  "component_details": {
    "business_durability": {
      "expected_fact_count": 3,
      "fact_coverage_pct": 100.0,
      "fact_fields": [
        "facts.competitive_position_score",
        "facts.moat_quality_score",
        "facts.management_quality_score"
      ],
      "known_fact_count": 3,
      "score": 80.67
    },
    "capital_discipline": {
      "expected_fact_count": 3,
      "fact_coverage_pct": 100.0,
      "fact_fields": [
        "facts.dilution_pct_yoy",
        "facts.capital_allocation_score",
        "facts.management_quality_score"
      ],
      "known_fact_count": 3,
      "score": 84.83
    },
    "cash_generation": {
      "expected_fact_count": 2,
      "fact_coverage_pct": 100.0,
      "fact_fields": [
        "facts.normalized_fcf_quality_score",
        "facts.fcf_margin_pct"
      ],
      "known_fact_count": 2,
      "score": 61.36
    },
    "financial_resilience": {
      "expected_fact_count": 2,
      "fact_coverage_pct": 50.0,
      "fact_fields": [
        "facts.cash_debt"
      ],
      "known_fact_count": 1,
      "score": 98.16
    },
    "through_cycle_quality": {
      "expected_fact_count": 1,
      "fact_coverage_pct": 100.0,
      "fact_fields": [
        "facts.normalized_cycle_quality_score"
      ],
      "known_fact_count": 1,
      "score": 75.0
    }
  },
  "economic_archetype": "cyclical",
  "evidence_lineage": [
    {
      "as_of": "2026-08-18T13:32:00Z",
      "evidence_id": "MU-e11",
      "field": "facts.capital_allocation_score",
      "period": "FY2025+Q3 FY2026",
      "quality_status": "verified",
      "retrieved_at": "2026-08-18T13:32:00Z",
      "source": {
        "accession_or_edgar_handle": "0000723125-25-000028+0000723125-26-000015",
        "filing_lineage": "SEC via MetricDuck",
        "period": "FY2025+Q3 FY2026",
        "provider": "metricduck",
        "source_id": "md:0000723125-25-000028+0000723125-26-000015",
        "source_type": "official_filing",
        "transport": "metricduck_sec_filing"
      },
      "unit": "score_0_100"
    },
    {
      "as_of": "2026-05-28T00:00:00Z",
      "evidence_id": "MU-e01",
      "field": "facts.cash",
      "period": "Q3 FY2026",
      "quality_status": "verified",
      "retrieved_at": "2026-08-18T13:32:00Z",
      "source": {
        "accession_or_edgar_handle": "0000723125-26-000015",
        "filing_lineage": "SEC via MetricDuck",
        "period": "Q3 FY2026",
        "provider": "metricduck",
        "source_id": "md:0000723125-26-000015",
        "source_type": "official_filing",
        "transport": "metricduck_sec_filing"
      },
      "unit": "USD"
    },
    {
      "as_of": "2026-08-18T13:32:00Z",
      "evidence_id": "MU-e06",
      "field": "facts.competitive_position_score",
      "period": "FY2025+Q3 FY2026",
      "quality_status": "verified",
      "retrieved_at": "2026-08-18T13:32:00Z",
      "source": {
        "accession_or_edgar_handle": "0000723125-25-000028+0000723125-26-000015",
        "filing_lineage": "SEC via MetricDuck",
        "period": "FY2025+Q3 FY2026",
        "provider": "metricduck",
        "source_id": "md:0000723125-25-000028+0000723125-26-000015",
        "source_type": "official_filing",
        "transport": "metricduck_sec_filing"
      },
      "unit": "score_0_100"
    },
    {
      "as_of": "2026-05-28T00:00:00Z",
      "evidence_id": "MU-e02",
      "field": "facts.debt",
      "period": "Q3 FY2026",
      "quality_status": "verified",
      "retrieved_at": "2026-08-18T13:32:00Z",
      "source": {
        "accession_or_edgar_handle": "0000723125-26-000015",
        "filing_lineage": "SEC via MetricDuck",
        "period": "Q3 FY2026",
        "provider": "metricduck",
        "source_id": "md:0000723125-26-000015",
        "source_type": "official_filing",
        "transport": "metricduck_sec_filing"
      },
      "unit": "USD"
    },
    {
      "as_of": "2025-08-28T00:00:00Z",
      "evidence_id": "MU-e05",
      "field": "facts.dilution_pct_yoy",
      "period": "FY2025",
      "quality_status": "verified",
      "retrieved_at": "2026-08-18T13:32:00Z",
      "source": {
        "accession_or_edgar_handle": "0000723125-25-000028",
        "filing_lineage": "SEC via MetricDuck",
        "period": "FY2025",
        "provider": "metricduck",
        "source_id": "md:0000723125-25-000028",
        "source_type": "official_filing",
        "transport": "metricduck_sec_filing"
      },
      "unit": "percent"
    },
    {
      "as_of": "2025-08-28T00:00:00Z",
      "evidence_id": "MU-e04",
      "field": "facts.fcf_margin_pct",
      "period": "FY2025",
      "quality_status": "verified",
      "retrieved_at": "2026-08-18T13:32:00Z",
      "source": {
        "accession_or_edgar_handle": "0000723125-25-000028",
        "filing_lineage": "SEC via MetricDuck",
        "period": "FY2025",
        "provider": "metricduck",
        "source_id": "md:0000723125-25-000028",
        "source_type": "official_filing",
        "transport": "metricduck_sec_filing"
      },
      "unit": "percent"
    },
    {
      "as_of": "2026-08-18T13:32:00Z",
      "evidence_id": "MU-e08",
      "field": "facts.management_quality_score",
      "period": "FY2025+Q3 FY2026",
      "quality_status": "verified",
      "retrieved_at": "2026-08-18T13:32:00Z",
      "source": {
        "accession_or_edgar_handle": "0000723125-25-000028+0000723125-26-000015",
        "filing_lineage": "SEC via MetricDuck",
        "period": "FY2025+Q3 FY2026",
        "provider": "metricduck",
        "source_id": "md:0000723125-25-000028+0000723125-26-000015",
        "source_type": "official_filing",
        "transport": "metricduck_sec_filing"
      },
      "unit": "score_0_100"
    },
    {
      "as_of": "2026-08-18T13:32:00Z",
      "evidence_id": "MU-e07",
      "field": "facts.moat_quality_score",
      "period": "FY2025+Q3 FY2026",
      "quality_status": "verified",
      "retrieved_at": "2026-08-18T13:32:00Z",
      "source": {
        "accession_or_edgar_handle": "0000723125-25-000028+0000723125-26-000015",
        "filing_lineage": "SEC via MetricDuck",
        "period": "FY2025+Q3 FY2026",
        "provider": "metricduck",
        "source_id": "md:0000723125-25-000028+0000723125-26-000015",
        "source_type": "official_filing",
        "transport": "metricduck_sec_filing"
      },
      "unit": "score_0_100"
    },
    {
      "as_of": "2026-08-18T13:32:00Z",
      "evidence_id": "MU-e09",
      "field": "facts.normalized_cycle_quality_score",
      "period": "FY2025+Q3 FY2026",
      "quality_status": "verified",
      "retrieved_at": "2026-08-18T13:32:00Z",
      "source": {
        "accession_or_edgar_handle": "0000723125-25-000028+0000723125-26-000015",
        "filing_lineage": "SEC via MetricDuck",
        "period": "FY2025+Q3 FY2026",
        "provider": "metricduck",
        "source_id": "md:0000723125-25-000028+0000723125-26-000015",
        "source_type": "official_filing",
        "transport": "metricduck_sec_filing"
      },
      "unit": "score_0_100"
    },
    {
      "as_of": "2026-08-18T13:32:00Z",
      "evidence_id": "MU-e10",
      "field": "facts.normalized_fcf_quality_score",
      "period": "FY2025+Q3 FY2026",
      "quality_status": "verified",
      "retrieved_at": "2026-08-18T13:32:00Z",
      "source": {
        "accession_or_edgar_handle": "0000723125-25-000028+0000723125-26-000015",
        "filing_lineage": "SEC via MetricDuck",
        "period": "FY2025+Q3 FY2026",
        "provider": "metricduck",
        "source_id": "md:0000723125-25-000028+0000723125-26-000015",
        "source_type": "official_filing",
        "transport": "metricduck_sec_filing"
      },
      "unit": "score_0_100"
    }
  ],
  "issuer_id": "ISSUER:MICRON_TECHNOLOGY_INC",
  "kind": "qrgf_quality_passport",
  "listing_overlay": "none",
  "quality_policy_version": "4.0.0-structural-v1",
  "schema_version": "1.0.0",
  "structural_facts": {
    "capital_allocation_score": 78,
    "cash": 24995000000,
    "competitive_position_score": 82,
    "debt": 5722000000,
    "dilution_pct_yoy": 1.1723,
    "fcf_margin_pct": 4.4625,
    "management_quality_score": 82,
    "moat_quality_score": 78,
    "normalized_cycle_quality_score": 75,
    "normalized_fcf_quality_score": 62
  },
  "summary": {
    "archetype_resolution": "cycle_evidence",
    "as_of": "2026-08-18T13:32:00Z",
    "contract_id": "9939",
    "economic_archetype": "cyclical",
    "evidence_validated": true,
    "hard_vetoes": [],
    "issuer_id": "ISSUER:MICRON_TECHNOLOGY_INC",
    "listing_overlay": "none",
    "missing_clearance_checks": [],
    "quality_components": {
      "business_durability": 80.67,
      "capital_discipline": 84.83,
      "cash_generation": 61.36,
      "financial_resilience": 98.16,
      "through_cycle_quality": 75.0
    },
    "quality_coverage_pct": 90.91,
    "quality_eligible": true,
    "quality_policy_version": "4.0.0-structural-v1",
    "quality_result_sha256": "fa9baa2ed345be09f8689a614213fc46bf388bc4295b90cba7d6dcfe4e2f478f",
    "quality_score": 82.23,
    "quality_status": "pass",
    "quality_status_reason": "structural_quality_gate_passed",
    "reuse_class": "structural_quality",
    "security_type": "common_equity",
    "ticker": "MU"
  }
}
